{
  "submission_id": "e19177d4-1c0d-4c54-aa1d-8400599b6c0e",
  "submitted_at": "2025-07-24T15:26:53.939110",
  "status": "pending",
  "repository_url": "https://github.com/par4m/orb",
  "repo_full_name": "par4m/orb",
  "submitter_name": "Param Arora",
  "submitter_email": "paramarora1405@gmail.com",
  "short_description": "Test Repository",
  "topic_area_ai": "life-sciences",
  "university": "UCD",
  "contact_name2": "",
  "contact_email2": "",
  "contact_name3": "",
  "contact_email3": "",
  "funder1": "",
  "grant_number1_1": "",
  "grant_number1_2": "",
  "grant_number1_3": "",
  "funder2": "",
  "grant_number2_1": "",
  "grant_number2_2": "",
  "grant_number2_3": ""
}