{
  "submission_id": "6b3f5e4b-23bb-42dd-ab88-33f70c654c82",
  "submitted_at": "2025-07-24T14:57:12.887759",
  "status": "pending",
  "repository_url": "https://github.com/par4m/orb",
  "repo_full_name": "par4m/orb",
  "submitter_name": "Param Arora",
  "submitter_email": "paramarora1405@gmail.com",
  "short_description": "This is PR submission Test",
  "topic_area_ai": "health-and-medical-sciences",
  "university": "UCSF",
  "contact_name2": "",
  "contact_email2": "",
  "contact_name3": "",
  "contact_email3": "",
  "funder1": "",
  "grant_number1_1": "",
  "grant_number1_2": "",
  "grant_number1_3": "",
  "funder2": "",
  "grant_number2_1": "",
  "grant_number2_2": "",
  "grant_number2_3": ""
}